Código,Produto
49612,OLEO MOTOR IPIRANGA 5W30 F1 MASTER SP
35633,AGUA DESMINERALIZADA ORBI 1LT
1040,THINNER B52 VELOZ LITRO
46597,ADITIVO RAD ROSA A05 PRONTO USO
9498,LAMPADA PINGO DAGUA FAROL W5W12V
49612,OLEO MOTOR IPIRANGA 5W30 F1 MASTER SP
2896,OLEO MOTOR DULUB ECONOLINE 20W50 SL
42309,OLEO DULUB TRANSM DX3 AUT ATF SEMI SINT
15922,OLEO MOTOR IPIRANGA F1 15W40 SL
4400,ADITIVO RAD ROSA PARAFLU PRONTO P/ USO
13908,OLEO MOTOR IPIRANGA F1 20W50 SL
14097,OLEO FREIO DOT4 500ML ATE
834,RETENTOR HASTE VALV GOL POWER
746,DESCARBONIZANTE CAR80
51192,SILICONE NEUTRO ALTA TEMP PRO PRETO WURTH 85G
4025,LAMPADA 2 POLOS 12V P21/5W
30274,ARREBITE LONA VW 4X6
49611,OLEO MOTOR IPIRANGA 5W40 F1 MASTER SP
35163,LAMPADA 1 POLO 12V 21W HALOWAY
M0991,VELA IGNICAO GOL GV POWER
27908,ADITIVO RAD ROSA ORBI QUIMICA
2985,LAMPADA H4 60/55W
25221,RETENTOR LATERAL TRANSMI CORSA
4167,FILTRO COMBUSTIVEL CORSA PALIO FIRE
6814,BIELETA BARRA ESTAB DIANT GOL GV
27539,OLEO UNIVERSAL DULUB CAMBIO 90 GL4
22117,VELA IGNICAO PALIO FIRE PEUG 208
3041,VELA IGNICAO CORSA CELTA FLEX
586,CORREIA DENTADA CORSA 111D
3732,FILTRO OLEO GOL MI POWER
48554,FILTRO OLEO PALIO FIRE
11550,RETENTOR HASTE VALV PALIO FIRE
52838,OLEO FREIO DOT4 PARAFLU 500ML
53748,ADITIVO RAD ROSA MAHLE PRONTO USO
7506,OLEO MOTOR IPIRANGA DIESEL BRUTUS 15W40
14454,FILTRO COMBUSTIVEL PEUGEOT HB20
30277,DESENGRIPANTE ANTIFERRUGEM CAR LUB12
521,ABRAÇADEIRA 19X27 9MM
51658,OLEO MOTOR ACDELCO 5W30 DEXOS1 SP
49251,OLEO MOTOR IPIRANGA F1 MASTER SP 0W20
47035,OLEO UNIVERSAL CAMBIO 80W90 GL5 DULUB
635,LAMPADA H7 55W PHILPS
31804,ADITIVO RAD PARAFLU ROSA CONC
5777,FILTRO OLEO PALIO FIRE
12902,ABRAÇADEIRA 9X13 FITA 9MM
29045,OLEO MOTOR 5W20 SYNTHETIC MOTORCRAFT
28448,OLEO UNIVERSAL CAMBIO 80W GL4 DULUB
1635,PIVO SUSP DIANT PALIO UNO
1543,TAMPA OLEO PALIO FIRE AMARELA
10814,TENSOR CORREIA DENTADA CORSA
280,FUSIVEL LAMINA 15 AMP
4539,VELA IGNICAO PEUGEOT RENAULT
M1421,TUCHO MOTOR GOL POWER
991,FILTRO OLEO CORSA CELTA
12349,PARAFUSO RODA PALIO CASTELINHO 3005C
15213,OLEO MOTOR IPIRANGA SAE BRUTUS 5W30
573,RETENTOR HASTE VALV GOL
54666,"SELO BLOCO 30,40MM PALIO FIRE"
46551,OLEO TRANSMISSAO 75W80 API GL5 MAXON
M0733,FILTRO OLEO CORSA CELTA
50082,OLEO MOTOR SELENIA PERFORM 5W30 SP
18326,JG PASTILHA FREIO DIANT UNO NOVO
3729,FILTRO COMBUSTIVEL CORSA PALIO
279,FUSIVEL LAMINA 10 AMP
8944,OLEO MOTOR MAXI PERFORMACE SAE 5W40 SN
35594,LIMPA CONTATO CAR80 300ML
26361,KIT AMORT DIANT GOL GV COMPLETO
M3474,FILTRO OLEO FIESTA KA
6944,TERMINAL BATERIA POSITIVO
10631,FUSIVEL MINI LAMINA 10 AMP
13779,CORREIA DENTADA GOL MI 135D
1061,OLEO MOTOR CASTROL GTX ANTIBORRA 20W50
27255,PARAFUSO CABEÇOTE CORSA
32414,PORCA RODA CROMADA ONIX
1945,KIT COIFA L CAMBIO PALIO
31951,OLEO MOTOR SYNTIUM 7000 0W20
44563,GUIA VALVULA GOL POWER STD1
30727,VELA IGNICAO NOVO FORD KA
52024,"SELO BLOCO CORSA 34,40MM"
53127,OLEO MOTOR MOBIL 5W30 SP
19836,PARAFUSO RODA CROMADO PALIO 06004
54493,LIXA D AGUA 331Q P80 3M
29782,VELA IGNICAO VW UP
34497,VELA IGNICAO MOBI EVO ETORQ
M3199,VELA IGNICAO FIESTA
2969,VELA IGNIÇAO PALIO FIRE
2969,VELA IGNICAO PALIO FIRE
19838,PARAFUSO RODA CROMADO CORSA 08003
M1442,CORREIA DENTADA PALIO FIRE 129D
5912,FILTRO CABINE GOL GV POLO/FOX
27700,FILTRO OLEO VW UP FOX
38721,SILICONE SPRAY CAR80 300ML
7259,JUNTA TAMPA VALV CORSA CELTA
3041,VELA IGNIÇAO CORSA CELTA FLEX
47303,RETENTOR HASTE VALV LOGAN
11222,BOMBA AGUA CORSA CELTA
36725,OLEO IPIRANGA TRANSM ATF DEXRON DVI 1LT
53129,FILTRO CABINE COBALT
30262,BIELETA BARRA ESTAB PUNTO
508,RETENTOR HASTE VALV CORSA
M3348,BATERIA MOURA M60GD
43970,SILICONE ALTA TEMP PRETO DIRKO 70ML
31202,LIMPA RADIADOR ORBI QUIMICA 200ML
281,FUSIVEL LAMINA 20 AMP
47779,TENSOR CORREIA DENTADA PALIO
34029,ABRAÇADEIRA SEM FIM ZN 30X45X9
50081,OLEO MOTOR SELENIA PERFORM 5W40 SP
28885,BIELETA BARRA ESTAB ONIX
9119,"SELO BLOCO 30,40MM PALIO FIRE"
45800,COXIM AMORT DIANT COBALT ONIX
53748,ADITIVO RAD ROSA MAHLE PRONTO P/ USO
4690,VELA IGNICAO GOL POWER FLEX
25810,BUCHA BARRA ESTAB FOX
15683,KIT AMORT DIANT CORSA COMPL
44922,JUNTA TAMPA VALV PALIO MOBI
16070,OLEO CAMBIO DULUB 75W80
M0787,JUNTA TAMPA VALV PALIO FIRE
35730,ABRAÇADEIRA 25X40X9 SEM FIM ZN
12660,JG CABO VELA GOL GV FOX
41486,PALHETA LIMPADOR DIANT HB20
26178,FILTRO CABINE UNO NOVO
M0991,VELA IGNIÇAO GOL GV POWER
27896,OLEO FREIO DOT4 RADNAQ 500ML
46577,GUIA VALVULA FORD KA STD
54155,OLEO MOTOR DULUB 5W40 ULTRATECH SP
288,FUSIVEL MINI LAMINA 20 AMP
3756,KIT COIFA L CAMBIO PALIO
250,LAMPADA H1 55W
47258,OLEO MOTOR ACDELCO DEXOS1 0W20
41866,OLEO MOTOR MAXI ECONOMY 10W40 SP
40810,JUNTA FIXA L RODA GOL GV
27129,SENSOR TEMP UNO PALIO FIRE
2339,BIELETA BARRA ESTAB UNO NOVO
M0767,VELA IGNICAO CORSA FLEX
M5307,FILTRO CABINE PALIO FIRE
M0205,AGUA DESMINERALIZADA OX 1L
54144,OLEO LUBRAX TRANSM ATF DX6 DVI 1LT
50796,OLEO UNIVERSAL ULTRAGEAR GL5 80W90 IPIRANGA
7949,LAMPADA 1 POLO AMBAR HALOWAY
3205,KIT EMBREAGEM PALIO STRADA
12659,JG CABO VELA CORSA CELTA
26932,KIT AMORT DIANT LOGAN
10676,BOMBA AGUA UNO PALIO FIRE
1754,FILTRO OLEO PALIO FIRE
274,FUSIVEL MINI LAMINA 15 AMP
26361,KIT AMORT DIANT GOL GV
29054,PIVO SUSP COBALT
27530,BIELETA BARRA ESTAB NEW FIT
9505,BALANCIM ROLETADO CORSA PALIO
6766,CORREIA DENTADA PALIO 129D
29794,CORREIA ALTERN GOL GV GVI
M3198,VELA IGNICAO CELTA FLEX
M0827,VELA IGNICAO PALIO FIRE
10195,PARAFUSO CABEÇOTE GOL POLO FOX
21282,TERMINAL ENCAIXE
14626,ARREBITE LONA FIAT 3X6
21801,LAMPADA 1 POLO AMBAR PINO V UNIVERSAL
3374,ROLAMENTO RODA DIANT PALIO
14715,KIT ROLAMENTO TRAS GOL
52368,OLEO MOTOR SELENIA K 15W40 API SP VERMELHO
45914,ADITIVO RAD VERDE PARAFLU PRONTO P/ USO
254,LAMPADA 67 1 POLO PLACA VW 10W
33348,KIT AMORT DIANT NEW FIT
M4630,BUCHA BAND DIANT GOL GV
45818,RETENTOR HASTE VALV MOBI
M3110,CORREIA DENTADA PALIO FIRE 124D
4109,TERMINAL DIREÇAO CORSA CELTA
M2561,KIT BUCHA BARRA ESTAB PALIO FIRE
33860,FILTRO OLEO UNO MOBI 3CC
2785,BOMBA COMBUSTIVEL UNIVERSAL 159A FLEX
36726,OLEO TRANSMISSAO IPIRANGA ATF CVT
22027,JUNTA CABEÇOTE PALIO FIRE EVO
36643,PALHETA LIMPADOR CRUZE HB20
29308,VELA IGNICAO PICANTO HB20
1833,LAMPADA H7 12V HALOWAY
11411,BOMBA COMBUSTIVEL PALIO
8939,AMORT DIANT PALIO FIRE
23515,TERMINAL DIREÇAO FOX GOL GV LE
52189,TAMPA RESERV AGUA PALIO
46598,FILTRO OLEO HB20 ORIGINAL
8215,VEDA ESCAPE ORBI QUIMICA 100G
11020,AMORT DIANT GOL GV
6382,DISCO FREIO DIANT GOL VOYAGE
4693,JG CABO VELA PALIO FIRE FLEX
M0740,KIT ROLAMENTO RODA TRAS CORSA
37027,BIELETA BARRA ESTAB DIANT/TRAS TORO
25739,BIELETA BARRA ESTAB DIANT HB20
31249,PALHETA LIMPADOR FIT ETIOS
36152,SILICONE ALTA TEMP PRETO SUN
49177,"ABRAÇADEIRA PRESSAO 11,3"
24416,RETENTOR LATERAL TRANSM CORSA
3708,ROLAMENTO RODA DIANT GOL
M1531,ROLAMENTO COIFA CAMBIO PALIO
24588,BIELETA BARRA ESTAB COBALT
36152,SILICONE ALTA TEMP PRETO
6519,KIT AMORT DIANT PALIO
10042,KIT AMORT TRAS PALIO PARCIAL
46687,FILTRO OLEO PALIO FIRE
28145,ABRAÇADEIRA ZINCADA 22X32
35875,PNEU 175/65 R14 82T SP TOURING R1
35875,PNEU 175/65 R14 82T SP TOURING R1
16615,KIT AMORT DIANT PALIO MOBI
4029,AMORT TRAS PALIO MPI FIRE
M0443,TERMINAL DIREÇAO PALIO LD
42111,PALHETA LIMPADOR DIANT GOL
25402,FILTRO OLEO CLIO SANDERO
M0270,BALANCIM MOTOR CORSA
52836,OLEO FREIO 500ML DOT3 PARAFLU
M3198,VELA IGNIÇAO CELTA FLEX
M0250,RETENTOR HASTE VALV CLIO
53496,FILTRO AR PALIO FIRE SIENA
M4669,BUCHA BARRA ESTAB DIANT FOX GOL GV
1010,RETENTOR HASTE VALVULA FIESTA
18493,LAMPADA PINGAO MEDIA
19495,BOMBA AGUA GOL POWER
10442,TERMINAL DIREÇAO PALIO LE
30452,TENSOR CORREIA ALTERN PALIO FIRE
53622,ADITIVO RAD CONC ROSA MAHLE
27612,CORREIA DIREÇAO HIDRAULICA PALIO
32943,ADITIVO COMBUSTIVEL FLEX
54160,ABRAÇADEIRA 26X38 9MM
30942,KIT AMORT DIANT PRISMA
7941,TENSOR CORREIA DENTADA UNO EVO
54144,OLEO LUBRAX TRANSM ATF DX6 DVI 1LT
45043,BRAÇO DIREÇAO FOX POLO GOL GV
23516,TERMINAL DIREÇAO FOX GOL GV LD
M2872,TUBO REFRIGERAÇAO GOL POWER
12580,KIT BARRA ESTAB CORSA
32141,ABRAÇADEIRA PLASTICA PRETA 30CM
3198,AMORT DIANT CORSA CELTA
51943,KIT AMORT DIANT COMPLETO PALIO LE
21012,JUNTA CABEÇOTE GOL AT POWER
46920,CARCAÇA VALV TERM FOX
1070,RETENTOR POLIA BOMBA GOL
23688,TUBO REFRIGERAÇAO PALIO UNO FIRE
27527,ADITIVO MOTOR BREAK SMOKE PROLONGA
51067,BUCHA BAND DIANT GOL GOLF
35544,PRATO SUP AMORT DIANT GOL GV
6115,LIMPA AR COND CARRO NOVO ORBI
749,FILTRO OLEO FIESTA ECOSPORT
25676,ROLAMENTO RODA DIANT GOL GV
4370,AMORT TRAS CORSA CELTA
29025,BRAÇO DIREÇAO FIESTA KA
34679,KIT AMORT TRAS NEW FIESTA
25243,BIELETA BARRA ESTAB DIANT GOL
496,RETENTOR COMANDO CORSA
34497,VELA IGNIÇAO MOBI EVO ETORQ
22118,VELA IGNICAO UNO ETORQ EVO
47492,FILTRO AR ONIX
14043,KIT AMORT TRAS GOL PARATI
1008,VELA IGNICAO ASTRA CORSA
45496,FILTRO OLEO UNO
41744,RETENTOR HAST VALVULA HB20
531,ABRAÇADEIRA 14X22 9MM
283,FUSIVEL LAMINA 30 AMP
32836,JG CABO VELA ONIX
9351,JUNTA FIXA CORSA CELTA
19021,JG CABO VELA UNO EVO
52470,GRAXA UNIVERSAL CHASSIS DULUB 500G
39986,LAMPADA H7 12V 55W
12903,ABRACADEIRA SEM FIM ZN 70X90X9
773,KIT EMBREAGEM MONTANA CORSA 200MM
40750,CORREIA ALTERN POLY V ONIX
41033,CORREIA ALTER LOGAN
49303,PIVO SUSP INF DIANT PALIO FIRE
47462,FILTRO AR UNO EVO
29782,VELA IGNIÇAO VW UP
28392,FILTRO CABINE TUCSON
23620,FILTRO CABINE NOVO UNO
20915,SELO BLOCO UNO PALIO FIRE
32412,PERNO RODA DIANT SPIN ONIX
526,ABRAÇADEIRA 44X57 9MM
7709,CAPA TERMINAL ENCAIXE FEMEA
2364,KIT EMBREAGEM PALIO SIENA FIRE
52457,BATERIA 60AH MAXFOR
27725,TENSOR CORREIA DENTADA GOL 8V
55051,TENSIONADOR ALTERN GOLF UP
M3976,CILINDRO RODA TRAS STRADA
16230,OLEO MOTOR IPIRANGA MASTER 10W40
54157,OLEO MOTOR DULUB ULTRATECH 5W30 SP
M2087,PIVO SUSP DIANT PALIO FIRE
20251,PASTILHA LIMPA PARABRISA
51962,LIMPA PARABRISA BLACK PRIME 100ML
25003,PARAFUSO RODA CROMADO GOL 05001
44209,CILINDRO MESTRE EMBREAGEM HB20
32042,JG PISTAO MOTOR GOL
26836,CUBO RODA TRAS PALIO NOVO
36501,DISCO FREIO DIANT PRISMA ONIX
1011,RETENTOR VOLANTE CORSA
54454,VALVULA ESCAPE UNO MOBI
46669,OLEO MOTOR IPIRANGA 10W30 F1 MASTER
20006,CILINDRO RODA TRAS GOL
41862,TUCHO HID MOTOR CELTA AGILE
5760,MANGUEIRA LONADA AZUL INJ ELETRONICA 7MM
46560,GUIA VALVULA ADM/ESC KWID STD
8931,GUIA VALVULA ADM PALIO UNO EVO STD
52186,FILTRO CABINE RENAULT KWID
12067,VELA IGNIÇAO CLIO SANDERO
9148,ABRAÇADEIRA 38X51 9MM
509,RETENTOR HASTE VALV GOL
18520,PNEU 185/65 R15 88H TE307 TRIANGLE
31798,AMORT DIANT ONIX LE
31797,AMORT DIANT ONIX LD
36311,KIT AMORT TRAS ONIX
31924,BRAÇO DIREÇAO PALIO FIRE
1543,TAMPA OLEO PALIO FIRE AMARELA
53935,PORCA RODA CROMADA ONIX
4181,BUCHA BAND DIANT PALIO
1061,OLEO MOTOR CASTROL GTX ANTIBORRA 20W50
12903,ABRACADEIRA SEM FIM ZN 70X89X9
M4614,BOMBA OLEO GOL FOX POWER
33567,KIT AMORT TRAS UNO PALIO
M1197,KIT ROLAMENTO RODA TRAS GOL
32126,CARCAÇA VALV TERM FOX
42259,INTERRUPTOR PRESSAO OLEO UNO PALIO
M2184,CORREIA ALTERN PALIO FIRE
45548,PALHETA AEROFIT CELTA
28449,OLEO UNIVERSAL CAMBIO 140 GL4 DULUB
6106,JUNTA TAMPA VALV UNO EVO
55400,OLEO UNIVERSAL MAXON CAMBIO 90 GL4
M0322,JG ORING BICO INJETOR
26276,AMORT TRAS PALIO
12982,SUPORTE BARRA TENSOR CORSA LD
M5041,JG CABO VELA CORSA CELTA
16655,INTERRUPTOR OLEO FOX GOL
10167,AMORT MALA PALIO
42310,OLEO DULUB TRANSMISSAO AUT ATF CVT 1LT
15457,CORREIA ALTERN PALIO
24231,KIT AMORT TRAS HB20
11465,TAMPA RESERV AGUA GV KOMBI
2712,RETENTOR COMANDO PALIO FIRE
6666,PORCA RODA CIVIC FIT 08004
46921,TUBO REFRIGERACAO GOL POWER
47228,FILTRO OLEO HB20 ORIGINAL
M3735,BUCHA BAND DIANT PALIO
53544,FILTRO CABINE CELTA
19830,PARAFUSO RODA CROMADO GOL 05003
277,FUSIVEL LAMINA 05 AMP
31422,JUNTA FIXA COBALT ONIX
18303,DISCO FREIO DIANT UNO MOBI
10968,JG PASTILHA FREIO DIANT GOLF
38734,JG PASTILHA FREIO DIANT GOL GV
6188,TENSOR CORREIA DENTADA GOL
24413,RETENTOR EIXO PILOTO PALIO
26466,VELA IGNICAO KIA SOUL HB20
17031,VELA IGNICAO CITROEN C3 C4
54452,VALVULA ESCAPE PEUGEOT CLIO
8964,KIT AMORT TRAS POLO FOX
49541,INTERRUPTOR OLEO UNO PALIO
18494,LAMPADA H11 FAROL NEBLINA AUDI TH11
54451,VALVULA ADMISSAO PEUGEOT CLIO
39267,FILTRO OLEO CROSSFOX UP GOL 3CC
2701,FILTRO OLEO PEUGEOT 206
2573,VELA IGNICAO CORSA CELTA
9671,BUCHA BAND DIANT GOL
4690,VELA IGNIÇAO GOL FLEX
45551,KIT BARRA ESTAB DIANT CORSA
28441,PARAFUSO CABEÇOTE PALIO FIRE
1679,PARAFUSO RODA CROMADO PEUGEOT 206
21184,BUCHA BARRA ESTAB DIANT CORSA
2224,BOBINA IGNIÇAO GOL POWER
38268,KIT AMORT DIANT ONIX LE/LD
44208,CILINDRO AUX EMB HB20
19931,CUBO RODA TRAS PALIO
M2038,BICO INJETOR PALIO MPI E FIRE
37011,RESISTENCIA ELETROV MOBI NOVO UNO
26196,JG PASTILHA FREIO DIANT NEW FIESTA
12983,SUPORTE BARRA TENSOR CORSA LE
M1458,ROLAMENTO COIFA CAMBIO PALIO
8519,VALVULA TERMOST PALIO FIRE
M2522,VALVULA TERMOST CORSA PALIO
31066,PIVO SUSP FOX GOL GV LE
31070,PIVO SUSP FOX GOL GV LD
M0473,ENGRENAGEM VIRABREQUIM CORSA
21061,OLEO MOTOR CASTROL MAGNATEC 5W40
54461,OLEO MOTOR LUBRAX VALORA SP 5W30
M5148,KIT AMORT DIANT UNO NOVO PARCIAL
30102,BIELETA BARRA ESTAB DIANT PUNTO
48623,PALHETAS LIMPADOR KWID
29160,FILTRO AR HB20
31009,KIT COIFA L RODA PALIO
35539,KIT AMORT TRAS CORSA
39966,BICO PNEU UNIVERSAL TR414
50559,"ABRAÇADEIRA NYLON 7,5X4 PRETA UNIFORT"
290,FUSIVEL MINI LAMINA 30 AMP
51448,KIT EMBREAGEM HB20
12468,KIT EMBREAGEM GOL GV GOLF
29842,AMORT TRAS ONIX PRISMA
52242,POLIA ALTERNADOR FORD KA
11018,AMORT TRAS GOL VOYAGE
27767,ROLAMENTO RODA DIANT STRADA
54636,KIT AMORT DIANT LOGAN
32084,DISCO FREIO DIANT SANDERO
20708,JUNTA CABEÇOTE GOL FOX
7802,BUCHA BAND TRAS PALIO LE
36642,ARTICULADOR CABO ENGATE GOL FOX
4053,BIELETA BARRA ESTAB DIANT PEUGEOT
2790,TERMINAL CABO ALAVANCA CORSA
34950,CABO EMBREAGEM CORSA CELTA
37511,TAMPA RESERV AGUA ONIX ARGO
33851,PALHETA LIMPADOR DIANT FOX
48640,PALHETA LIMPADOR AEROFIT FIESTA
42917,PALHETA SILICONE UNIVERSAL
M4986,CONEXAO MANGUEIRA COL ADMISSAO PALIO
29815,CONECTOR 2 VIAS
32448,KIT COIFA L CAMBIO PALIO
M4813,TAMPA RESERV AGUA CELTA
4173,FILTRO AR PALIO
M4681,BUCHA BAND DIANT PALIO
16814,BUCHA BRAÇO TENSOR DIANT UNO
13794,TERMINAL BATERIA POSITIVO SAPAO
3805,ADITIVO RAD CONC ROSA TROPICAL T5
26768,BATERIA MOURA M50ED
35765,CABO SELEÇAO MARCHA CORSA
7954,PNEU 175/65 R14 82H XBRI
2202,RETENTOR VOLANTE PALIO FIRE
53363,SENSOR TEMP GOLF GOL CINZA
38975,CABO EMBREAGEM MOBI
22556,RESERV AGUA RAD NOVO UNO
54856,VELA IGNICAO UNO MOBI ARGO
49309,BRAÇO DIREÇAO ETIOS
M2483,ARRUELA ENCOSTO GOL
867,JG PASTILHA FREIO PALIO
39853,BUCHA BAND TRAS COBALT
34869,BIELETA BARRA ESTAB DUSTER
12884,TAMPA RADIADOR RANGER
31522,CORREIA ALTERN HB20
48639,PALHETA LIMPADOR AEROFIT GOL
33028,PALHETA LIMPADOR DIANT FIT LD
1040,THINNER B52 VELOZ LITRO
52835,ADITIVO RAD AZUL PARAFLU PRONTO USO
49808,FILTRO CABINE NEW FIT
47699,FILTRO CABINE TUCSON
47344,FILTRO CABINE ECOSPORT
24018,KIT DESLIZADOR BANCO GOL
48554,FILTRO OLEO PALIO FIRE
19834,PARAFUSO RODA CROMADO UNO 06001
51546,AMORT TRAS NEW FIESTA
18331,JG PISTAO GOL POLO
7815,COXIM AMORT DIANT PALIO LD
M3471,TAMBOR FREIO UNO
7399,TENSOR CORREIA DENTADA CORSA
55184,TENSOR CORREIA DENTADA CORSA
52011,VALVULA ADMISSAO MOBI
30149,TRIZETA UNO WAY ARGO
3946,SAPATA FREIO PALIO
7191,CUBO RODA DIANT PALIO
43709,PALHETA LIMPADOR ONIX
7803,BUCHA BAND TRAS PALIO LD
40531,TUCHO MOTOR PEUGEOT C3
26744,BRAÇO DIREÇAO CORSA CELTA
28908,BIELETA BARRA ESTAB DIANT NOVO UNO
147,KIT AMORT DIANT NEW FIESTA
15164,BALANCIM ROLETADO GOL POWER
48623,PALHETAS LIMPADOR PALIO KWID
30025,ANTI CHAMA GOL POWER
49196,TUBO REFRIGERAÇAO ONIX
4539,VELA IGNIÇAO PEUGEOT RENAULT
44735,FILTRO AR GOL FOX
48321,TUCHO MOTOR CORSA CELTA
33420,INTERRUPTOR OLEO CORSA
10622,KIT AMORT TRAS GOL NOVO
M0357,VELA IGNICAO CORSA DOBLO
52912,GUIA VALVULA PALIO
36549,BUCHA BAND DIANT DUSTER
1528,TUCHO MOTOR CELTA CORSA
6848,JUNTA COLETOR ESCAP PALIO FIRE
48257,RETENTOR HAST VALVULA RAV4
M3201,VELA IGNICAO HONDA FIT
5803,GUIA VALVULA GOL STD
4690,VELA IGNICAO GOL FLEX
645,ADESIVO JUNTA 3M 73G
8709,VELA IGNICAO CORSA CELTA
18390,FILTRO CABINE LOGAN SANDERO
39291,FILTRO AR GOL POWER
46581,GUIA VALVULA CLIO STD
10771,TAMPA OLEO MOTOR GOL
3860,RETENTOR HASTE VALV PEUGEOT
1643,RELE AUX GOL CHEVETTE UNIVERSAL
52077,RETENTOR HASTE VALV PALIO FIRE
M0767,VELA IGNIÇAO CORSA FLEX
29946,ABRAÇADEIRA ESCAPAMENTO 1 7/8
49300,SUPER BONDER 3G LOCTITE
27951,FITA ISOLANTE 19MMX10M TECH ONE
42874,BATERIA CRALL CS60D 12M
52351,KIT EMBREAGEM KWID
31344,AMORT DIANT ETIOS
49963,AMORT DIANT LOGAN
31146,AMORT DIANT NEW FIESTA LE
7814,COXIM AMORT DIANT PALIO LE
14814,KIT AMORT DIANT COMPLETO PALIO LD
2223,TENSOR CORREIA DENTADA GOL 8V
8818,RESISTENCIA ELETROV GOL GV
6270,BRAÇO DIREÇAO FOX POLO GOL
52034,VARETA NIVEL OLEO PALIO FIRE
37471,CABO EMBREAGEM PALIO ELX
49548,INTERRUPTOR OLEO GOL GV
25719,TENSOR CORREIA ALTERN CORSA ONIX
M3543,JUNTA TAMPA VALV FIESTA
52888,ANTI CHAMA GOL POWER
38561,CORREIA ALTERN GOL
775,BIELETA BARRA ESTAB FIESTA
21966,BRAÇO DIREÇAO NOVO UNO
48840,OLEO TRANSM ATF DEXRON DVI 20W MAXON
22308,TUBO REFRIGERAÇAO CELTA
50462,ROLAMENTO ALTERNADOR
44834,PALHETA SILICONE UNIVERSAL
37307,FILTRO OLEO HB20 CIVIC
34667,TUBO ENTRADA AGUA CORSA
8196,GRAXA BRANCA LITIO SPRAY
9253,FILTRO OLEO GOL FOX
23083,ANEL BOBINA FIRE EVO
289,FUSIVEL MINI LAMINA 25 AMP
49942,PNEU 195/65 R15 91V DELMAX
M1604,PNEU 175/70 R14 DUNLOP
21902,KIT AMORT DIANT NOVO UNO
44793,TENSIONADOR CORREIA ALTERN PALIO
5011,DISCO FREIO DIANT PALIO SIENA
M3837,DISCO FREIO DIANT CELTA
43605,OLEO MOTOR 5W30 A5 CASTROL MAGNATEC PROFESSIONAL
37614,CORREIA ALTERN PEUGEOT VW UP
32622,BIELETA BARRA ESTAB DIANT COROLLA
46734,ROLAMENTO RODA DIANT CORSA
48298,CORREIA ALTERN MOBI
51188,FLANGE BOMBA COMB PALIO FIRE
18789,TENSOR CORREIA ALTERN GOL
16278,BRAÇO DIREÇAO FIESTA ECOSPORT KA
45738,CORREIA ALTERN UNO PALIO
31415,TENSOR CORREIA ALTERN FOX
24070,ANTI CHAMA GOL POWER
40970,CORREIA ELASTICA SANDERO
50206,TERMINAL DIREÇAO PALIO LE
39122,REPARO CABO SELEÇAO ENGATE CORSA
21751,BUCHA BAND SUSP DIANT LOGAN
48356,FILTRO AR FOX
29962,PALHETA LIMPADOR PARABRISA L200
42911,PALHETA DIANT SILICONE UNIVERSAL
34936,BIELETA BARRA ESTAB DIANT ETIOS
27431,KIT BARRA ESTAB DIANT AGILE
48309,KIT COIFA L RODA GOL
27535,FILTRO CABINE TOYOTA ETIOS
26889,CONECTOR 2 VIAS ELETROV PALIO
21199,LAMPADA 2 POLOS PINGAO 21/5W/12V
41755,SILICONE ACETICO INCOLOR CAR80
39274,ARRUELA BUJAO CARTER LOGAN
13287,LAMPADA PINGAO 1 POLO BASE VIDRO
19835,PARAFUSO RODA CROMADO UNO 06003
4167,FILTRO COMBUSTIVEL CORSA PALIO FIRE
37672,KIT EMBREAGEM MOBI ARGO
7954,PNEU 175/65 R14 82H XBRI
31145,AMORT DIANT NEW FIESTA LD
44980,SENSOR ABS TRAS GOL GVI LD/LE
41563,COXIM CAMBIO INF ONIX
48465,VALVULA TERMOST UNO VIVACE
30858,SENSOR ABS TRAS GOL LE
40650,BOBINA IGNIÇAO HB20
28190,ROLAMENTO RODA DIANT PALIO MOBI ABS
54424,COXIM MOTOR GOL FOX LD
8554,BOMBA COMBUSTIVEL PALIO GOL
40527,JUNTA TAMPA VALVULA HB20
40888,JG PASTILHA FREIO DIANT KWID
45401,COXIM AMORT TRAS PUNTO
10030,RESERV AGUA RAD GOL GV FOX
44097,CABO EMBREAGEM KWID
15661,COXIM MOTOR PALIO FIRE LD
36103,TENSOR CORREIA ALTERN APOIO NOVO KA
30941,KIT AMORT DIANT PRISMA
32012,BIELETA BARRA ESTAB DIANT NEW FIT
2913,TRIZETA PALIO FIRE
3799,PALHETA LIMPADOR CORSA CELTA
6209,TENSOR CORREIA ALTERN PALIO FIRE
14893,CORREIA ALTERN PALIO
44937,JUNTA TAMPA VALV ONIX
14570,BRAÇO DIREÇAO NOVO UNO
461,CORREIA ALTERN CORSA
34371,TAMPA RESERV RAD PUNTO
52209,FILTRO AR UNO NOVO MOBI
16238,WATER OFF CRISTALIZADOR DE VIDROS
54371,FILTRO OLEO ONIX HATCH
49292,FILTRO OLEO COROLLA
7279,LIMPA CARTER POWER FLUSHING
40705,FILTRO OLEO ETIOS
11710,FILTRO OLEO PEUGEOT
32413,PERNO RODA TRAS SPIN ONIX
54809,KIT DESLIZADOR BANCO GOL
13336,LAMPADA PINGO DAGUA
2780,ABRAÇADEIRA 13X19 9MM
30513,PNEU 185/60 R15 88H BC20 SUMITOMO
49942,PNEU 195/65 R15 91V DELMAX
51671,VALVULA CANISTER ONIX
54498,PNEU 175/70 R13 82T ULTIMA JK TYRE
30285,KIT AMORT DIANT NEW FIESTA
15375,ATUADOR EMBREAGEM HIDR MONTANA
32306,SENSOR ABS DIANT GOL LD
40060,COXIM AMORT DIANT FORD KA
45896,KIT AMORT DIANT HB20
36633,DISCO FREIO DIANT NEW FIESTA
14814,KIT AMORT DIANTCOMPLETO PALIO LD
4538,CILINDRO AUX EMBREAGEM PALIO
13671,JG CABO VELA FIESTA ROCAM FLEX
M3446,DISCO FREIO STILO PUNTO VENT
24066,TAMBOR FREIO TRAS PUNTO 203MM
26256,BRAÇO OSCILANTE UNO
36087,MANGUEIRA RETORNO RESERV AGUA FORD KA
36657,KIT AMORT DIANT ETIOS LD/LE
24360,RESERV AGUA RAD CELTA
31020,TERMINAL DIREÇAO NEW FIESTA LD
53898,PIVO SUSP INF LOGAN LD/LE
19991,JG PASTILHA FREIO DIANT HB20
M4801,AMORT MALA PALIO CELTA
26222,KIT AMORT DIANT GOL GV COMPLETO
25784,PIVO SUSP GOL GV LD
49306,ROLAMENTO RODA DIANT PALIO
45828,OLEO MOTOR CASTROL MAGNATEC SUV 5W30 C3
32812,KIT AMORT TRAS COBALT
52493,CORREIA ALTERN DIR HID SAVEIRO
21006,MANGUEIRA FILTRO AR PALIO
8975,KIT AMORT DIANT UNO
674,JUNTA CABEÇOTE CORSA CELTA
41542,TERMINAL DIRECAO COBALT LD/LE
6368,CORREIA DENTADA CORSA
32142,BIELETA BARRA ESTAB FIESTA
38759,JG PASTILHA FREIO DIANT CORSA
54101,SILICONE ALTA TEMP CINZA DIRKO 70ML
36308,BIELETA BARRA ESTAB DIANT ETIOS
44263,CILINDRO RODA TRAS CELTA
M0477,TENSOR CORREIA ALTERN PALIO FIRE
55216,INTERRUPTOR OLEO PALIO
44873,FILTRO AR KWID
20004,VELA IGNICAO I30
M2047,RETENTOR LATERAL TRANSMI FIESTA KA
21786,PALHETA LIMPADOR TRAS GOL GV
18428,FILTRO AR NOVO UNO
27634,VELA IGNICAO LOGAN
17040,BUCHA BAND SUSP DIANT LOGAN
6640,LIMPA AR COND FLORAL 200ML ORBI
22388,TUBO REFRIGERACAO GOL
12459,OLEO FREIO 500ML DOT3 RADNAQ
21103,GUIA VALVULA CORSA MONTANA STD
29288,CONECTOR 1 VIAS INTERRUPTOR OLEO GOL
32415,PORCA RODA DIANT TRAS HB20
52707,BUCHA BARRA ESTAB DIANT COROLLA
991,FILTRO OLEO CORSA CELTA
14982,SOQUETE H4 FAROL PLASTICO UNIVERSAL
M4691,TAMPA UNIVERSAL BICO PNEU
282,FUSIVEL LAMINA 25 AMP
32221,KIT EMBREAGEM KA NOVO 3CC
30507,ELETROVENTILADOR CN FIT CITY
29633,ATUADOR EMBREAGEM MARCH
19516,SONDA LAMBDA GOL POWER
2365,KIT EMBREAGEM PALIO FIRE
M4872,KIT EMBREAGEM PALIO IDEA DOBLO
19264,BOBINA IGNIÇAO KWID
M5753,BOMBA OLEO CORSA CELTA
43661,BOBINA IGNICAO GOL GVI E GVII
12558,JUNTA FIXA PALIO FIRE
M1046,AMORT DIANT UNO MILLE
43926,JUNTA FIXA NOVO PALIO ARGO
32500,KIT AMORT DIANT MARCH
25946,KIT AMORT DIANT ONIX 4CC C0MPLETO
19938,SAPATA FREIO GOL GV
M2417,ANEL SINCRONIZADOR PALIO FIRE 1/2
32144,BOMBA AGUA PUNTO BRAVO
7017,ANEL SINCRONIZADOR 3º 4º PALIO
M1351,CILINDRO MESTRE EMBREAGEM PEDAL PALIO
23218,VELA IGNICAO SENTRA TIIDA VERSA
29077,JG PASTILHA FREIO DIANT VERSA
53764,KIT AMORT DIANT LOGAN
30268,JG PASTILHA FREIO DIANT ETIOS
30209,JG PASTILHA FREIO DIANT SANDERO
2885,CUBO RODA TRAS UNO
45111,RESERV AGUA RAD GOL GV
9865,BOBINA IGNIÇAO UNO PALIO
48276,KIT AMORT DIANT GOL GV
31669,CORREIA ALTERN ONIX ELASTICA
M2093,PIVO SUSP DIANT ECOSPORT FIESTA
5711,CORREIA ALTERN RENAULT FORD KA
21400,PALHETA LIMPADOR ECOSPORT KA
45114,RESERV AGUA RAD PALIO BEHR
35475,COXIM AMORT TRAS ECOSPORT
42703,BUCHA BAND DIANT PALIO LE
30716,JUNTA INJEÇAO ELET FOX GOL
35806,BRAÇO DIREÇAO ONIX PRISMA
49116,BIELETA DIANT ONIX
M1031,CILINDRO RODA TRAS PALIO
35002,OLEO MOTOR IPIRANGA SP DPF 0W30
50207,TERMINAL DIREÇAO PALIO LD
31528,BUCHA BAND DIANT HONDA FIT
9300,KIT AMORT TRAS LOGAN
35948,CORREIA DIREÇAO HIDRAULICA HB20
32621,BUCHA BAND DIANT PALIO
11867,MANGUEIRA RESERV AGUA FIESTA
19705,FILTRO AR NEW FIESTA FLEX
26754,PALHETA LIMPADOR TRAS PALIO
53198,FILTRO OLEO ONIX HATCH
12067,VELA IGNICAO CLIO SANDERO
M5864,REPARO PINÇA FREIO PALIO
11061,JUNTA COLETOR ADM PALIO FIRE
18662,MOLA APOIO TRIZETA PEUGEOT
13677,TAMPA RESERV AGUA PALIO
49737,FILTRO OLEO COROLLA ETIOS
34943,FILTRO OLEO FILTRO PALIO ETORQ
9356,FILTRO CABINE CELTA
25882,MANGUEIRA SANFONADA 260MM 1507
22560,JG EMBLEMA RESINADO CALOTA FIAT
54613,FILTRO OLEO KWID
53781,FILTRO CABINE PALIO FIRE
M1465,ATUADOR EMBREAGEM NOVO FORD KA
M5519,PNEU 195/55 R15 85V ULTIMAPRO DELMAX
16514,MOTOR VENT CAIXA AR PALIO FIRE
M0970,PNEU 175/70 R13 82T SH406 SAILLUN
35499,BATERIA ZETTA 60AMP
42164,JUNTA FIXA STRADA
40869,PNEU 175/75 R14 ECO307
38267,KIT AMORT DIANT UNO NOVO COMPLETO
25470,CUBO RODA TRAS GOL GVI ABS
3270,CUBO RODA TRAS STRADA
8087,TAMBOR FREIO TRAS DOBLO
46079,DISCO FREIO DIANT VENTILADO KWID
M5061,SENSOR NIVEL COMB PALIO
M5154,DISCO FREIO GOLF SPACEFOX
736,JG CABO VELA CORSA CELTA
44704,TENSOR CORREIA DENTADA CORSA
55441,JG PARAFUSO CABEÇOTE HB20
27371,SUPORTE BARRA TENSOR CORSA LD
45115,RESERV AGUA RAD PALIO VALEO
M2478,PORTA ESCOVA CELTA CORSA CLIO
4626,JG CABO VELA PALIO FLEX
19460,MANGUEIRA SUP RAD UNO NOVO
32392,BUCHA BAND DIANT ETIOS
42392,TERMINAL DIRECAO LOGAN LE
3842,CUBO RODA DIANT CELTA CORSA
14728,CORREIA DENTADA UNO PALIO 124D
40798,BIELETA BARRA ESTAB DIANT ETIOS
44784,TERMINAL DIRECAO FIESTA LD
13964,PIVO SUSP DIANT ECOSPORT FIESTA
19308,BUCHA BAND TRAS GOL GV/GOLF
41087,BIELETA BARRA ESTAB DIANT HB20
26742,TENSOR AUX ALTERN FIESTA
M3934,TERMINAL DIREÇAO UNO PREMIO
31096,KIT ROLAMENTO RODA TRAS CORSA
46567,BUCHA BAND TRAS COBALT
42259,INTERRUPTOR PRESSAO OLEO PALIO
55334,BUCHA BAND DIANT GOL GOLF
36654,KIT AMORT DIANT HB20
50754,BRAÇO DIREÇAO CORSA CELTA
26480,BUCHA BARRA ESTAB DIANT COROLLA
31778,KIT COIFA L CAMBIO HONDA FIT
3264,KIT COIFA L CAMBIO FIESTA
22639,BUCHA BARRA ESTAB PALIO FIRE
27698,FILTRO AR FOX GOL 3CC
28794,LAMPADA FAROL H8 SH
49261,PALHETA DIANT SILICONE UNIVERSAL
47922,ROLAMENTO ALTERN
38856,PALHETA DIANT SILICONE CORSA CELTA
46466,FILTRO OLEO DOBLO ETORQ
1905,BUCHA BAND DIANT CORSA/CELTA
49187,MANGUEIRA RESPIRO OLEO CORSA
10247,BUCHA BAND DIANT CORSA CELTA
51246,CONECTOR 2 VIAS SENSOR TEMP PALIO
39760,KIT COIFA L CAMBIO CORSA
16815,KIT BARRA ESTAB UNO
40713,KIT COIFA L RODA PALIO
54991,CONECTOR 2 VIAS ELETROV PALIO
8265,FILTRO COMBUSTIVEL FIESTA
31767,MANGUEIRA SANFONADA 275MM 1508
19153,LAMPADA H3 FAROL HALOWAY
10496,FILTRO AR CELTA PRISMA
35050,BUJAO CABEÇOTE PALIO FIRE
52333,KIT EMBREAGEM LOGAN VERSA
47131,RADIADOR OLEO CAMBIO TORO
46713,KIT DISTRIBUICAO DENTADA GOL UP 3CC
48306,SONDA LAMBDA PRE POS KWID LAR/CINZ
1520,BOMBA OLEO UNO PALIO FIRE
2811,SONDA LAMBDA GOL POWER
45630,AMORT DIANT PALIO ECONOMY
41830,COXIM MOTOR DIANT COBALT LD
37437,RADIADOR AGUA GOL GV AR
18520,PNEU 185/65 R15 88H TE307 TRIANGLE
16856,AMORT DIANT LOGAN
49451,BICO INJETOR FOX GOL GV
11411,BOMBA COMBUSTIVEL PALIO FLEX
49081,BANDEJA DIANT KWID LD
M4848,ATUADOR EMBREAGEM CORSA ONIX 4CC
32199,AMORT TRAS NEW FIESTA
47920,RESISTENCIA ELETROV LOGAN DUSTER
49521,BOMBA AGUA FORD KA 3CC
34123,COXIM AMORT DIANT PALIO UNO
