Código,Produto
54140,KIT DISTRIBUIÇAO GOL
17969,JG CABO VELA SANDERO LOGAN
3037,JG CABO VELA GOL POWER
55065,RESERV AGUA SANDERO
M0456,RETENTOR VOLANTE PALIO FIRE
36464,BOBINA IGNICAO HB20
38554,VELA IGNICAO UNO MOBI ARGO
9695,BORRACHA PORTA LATERAL C3 AIRCROSS
35643,SUPORTE BARRA TENSOR AGILE LE
44609,JUNTA TAMPA VALV HB20
M5487,JG PASTILHA FREIO TRAS GOLF
32427,COXIM AMORT DIANT PRISMA ONIX
23010,JG CABO VELA UNO EVO
3475,GUIA ROLAMENTO EMBREAGEM PALIO
38134,COXIM MOTOR CORSA CELTA LD
31115,TERMINAL DIREÇAO NEW FIESTA LE
39850,BICO INJETOR LOGAN
15910,JG BRONZE BIELA CORSA STD
18130,SENSOR ROTAÇAO PALIO FIRE
41764,COXIM AMORT SUSP TRAS COBALT
27372,SUPORTE BARRA TENSOR CORSA LE
51639,BRAÇO DIREÇAO RENEGADE
52624,TERMINAL DIREÇAO ARGO LD
25161,CUBO RODA DIANT GOL GIII
33339,TERMINAL DIRECAO COBALT LD/LE
M1899,TENSOR CORREIA DENTADA PALIO FIRE
42704,BUCHA BAND DIANT PALIO LD
38524,CABO EMBREAGEM UNO EVO
41663,PIVO SUSP DIANT GOL GV LE
52416,PIVO SUSP INF ARGO LE
18754,ROLAMENTO COMPRESSOR AR CORSA CVC
18435,KIT AMORT TRAS NEW FIESTA KA
51418,TERMINAL DIREÇAO FIESTA LE
6192,TENSOR CORREIA DENTADA PALIO FIRE
31728,BUCHA BAND TRAS HONDA FIT
47868,KIT AMORT DIANT CORSA MONTANA
30376,KIT COIFA L CAMBIO ONIX COBALT
22809,SENSOR VELOCIDADE PALIO FIRE
37470,CABO EMBREAGEM UNO MILLE
M2064,TERMINAL DIREÇAO PALIO LD
2549,BRAÇO DIREÇAO PALIO FIRE
32393,BUCHA BAND DIANT RENEGADE
50250,KIT AMORT TRAS HB20
54959,TENSOR ALTERN GOL MAIOR
1945,KIT AMORT DIANT FOX
48856,PALHETA LIMPADOR ARGO PB24
48855,PALHETA LIMPADOR ARGO PB15
29354,KIT AMORT TRAS PUNTO
49884,MANGUEIRA SUP RAD PALIO FIRE
9831,BUCHA BAND TRAS GOL GV
12063,TERMINAL DIREÇAO CORSA CELTA
44173,BUCHA BAND DIANT COBALT
10770,TAMPA RADIADOR HONDA CIVIC FIT
30727,VELA IGNIÇAO NOVO FORD KA
1752,FLEXIVEL FREIO DIANT UNO
39765,KIT AMORT TRAS PUNTO
39040,BUCHA BAND DIANT KWID
8115,TAMPA RESERV AGUA PEUGEOT
M4810,KIT COIFA L RODA CORSA CELTA
27438,BUCHA BARRA ESTAB DIANT FIT
27534,FILTRO CABINE NISSAN VERSA
45459,FILTRO CABINE CRUZE
6361,TAMPA RESERV A CORSA
47191,FILTRO CABINE FOX
41348,KIT TAMPAO BOMBA DA AGUA CHT
32411,PERNO RODA DIANT I30
M5770,ARVORE MANIVELA CORSA
312,KIT EMBREAGEM CORSA CELTA
13543,PNEU 185/70 R14 88H MH01 SPEEDMAX
13543,PNEU 185/70 R14 88H MH01 SPEEDMAX
18070,RETENTOR VOLANTE KOMBI
45034,AMORT DIANT HB20 LD
32685,AMORT TRAS HONDA CITY
54983,RADIADOR AGUA GOL GV AR
47313,KIT AMORT DIANT ONIX COMPLETO
49080,BANDEJA DIANT KWID LE
19462,MANGUEIRA INF RAD UNO NOVO
54745,CARCAÇA VALV TERM FORD KA
20689,JG PISTAO PALIO IDEA 040
54940,OLEO MOTOR DULUB MAX 3 TURBO 15W40 CI4 20L
47264,CILINDRO MESTRE EMBREAGEM GOL GV
43003,JUNTA FIXA PALIO WEEKEND ADV
29760,JG PISTAO C/ ANEL PALIO 040
M3317,AMORT TRAS ECOSPORT
32307,SENSOR ABS DIANT GOL LE
49324,KIT AMORT DIANT MARCH
26267,JG PISTAO COM ANEL CELTA
45626,BOBINA IGNIÇAO NOVO KA
40914,SAPATA FREIO ONIX
757,JG BRONZE MANCAL CORSA STD
51489,DISCO FREIO DIANT VENT SAVEIRO
36408,VELA IGNIÇAO FIT CITY
40941,JG PASTILHA FREIO HILUX SRV
33668,TAMBOR FREIO ONIX
54233,PIVO SUSP INF LD/LE DUSTER
16842,VELA IGNIÇAO NEW CITY
16842,VELA IGNICAO NEW CITY
M0243,JG PISTAO COM ANEL UNO
51881,BICO INJETOR NEW CIVIC
41699,VELA IGNICAO ETIOS
27120,VELA IGNIÇAO COROLLA
30946,KIT AMORT DIANT HB20
28929,VELA IGNICAO ETIOS
17622,TAMBOR FREIO TRAS UNO NOVO
M4975,RESISTENCIA ELETROV DUCATO PALIO
47408,COXIM AMORT DIANT KWID
36081,HASTE ALAVANCA SELETORA CORSA
19800,COXIM CAMBIO PALIO FIRE LE
35687,MANGUEIRA AR QUENTE ONIX PRISMA
37670,JG PASTILHA FREIO DIANT FOX
30483,TENSOR CORREIA DENTADA FOX GOL
49789,CILINDRO RODA TRAS ONIX
35642,SUPORTE BARRA TENSOR AGILE LD
39100,ARTICULADOR CABO ENGATE CORSA
50628,BALANCIM ROLETADO FIESTA ZETEC
46360,ROLAMENTO RODA DIANT GOL
50567,PIVO SUSP HB20
21002,MANGUEIRA FILTRO AR PALIO FIRE
49004,OLEO DULUB COMPRES AR COND COLDTECH PAG 46
41767,COXIM AMORT SUSP TRAS COBALT
51388,TERMINAL DIRECAO KWID LD/LE
44756,TERMINAL DIREÇAO NEW FIESTA LD
40749,CORREIA ALTERN POLY V ONIX
50273,CILINDRO RODA PALIO MOBI
42393,TERMINAL DIRECAO LOGAN LD
34433,OLEO MOTOR CASTROL MAGNATEC 0W20
39571,BRAÇO DIREÇAO ARGO CRONOS
38276,CABO FREIO GOL GV LE
11571,KIT AMORT DIANT COROLLA
55086,KIT ROLAMENTO RODA TRAS CORSA
44118,AMORT MALA NOVO FORD KA
46324,CORREIA ALTERN TORO RENEGADE
30091,SUPORTE BARRA TENSOR CORSA LD
46186,BRAÇO DIREÇAO CITY
M2063,TERMINAL DIREÇAO PALIO LE
7007,CILINDRO RODA PALIO WEEKEND
M2158,PIVO SUSP DIANT CORSA CELTA
2833,JG PASTILHA FREIO DIANT CORSA
7587,SAPATA FREIO CELTA
39596,BIELETA BARRA ESTAB DIANT MARCH
7319,KIT AMORT DIANT COROLLA PARCIAL
25149,CORREIA ALTERN PEUGEOT VW UP
36030,BIELETA BARRA ESTAB DIANT NEW FIT LD
M1536,TENSOR CORREIA ALTERN FIESTA
16764,JG PASTILHA FREIO DIANT UNO NOVO
9830,TENSOR CORREIA ALTERN PALIO FIRE
22490,CILINDRO RODA PALIO
31384,MANGUEIRA RESPIRO OLEO PALIO
3712,TERMINAL DIREÇAO GOL HD
40171,KIT AMORT DIANT ONIX PARCIAL
2848,JG PASTILHA FREIO DIANT PALIO
52415,PIVO SUSP DIANT CORSA CELTA
44565,TUCHO VALVULA FIESTA
51042,CILINDRO RODA CORSA
26466,VELA IGNIÇAO KIA SOUL HB20
44260,BUCHA BARRA ESTAB DIANT POLO
39041,BUCHA BAND TRAS KWID
43597,PALHETA SILICONE UNIVERSAL PA24
52456,PORTA ESCOVA MOTOR PALIO FIRE
46389,VALVULA ADMISSAO CORSA
35986,KIT AMORT TRAS COBALT SPIN
15088,VALVULA ADMISSAO CORSA
1473,BUCHA EIXO TRAS SANTANA GOL GV
12227,BUZINA CARACOL PALIO
50026,KIT AMORT TRAS FOX
51759,KIT COIFA L CAMBIO FIT
33354,KIT COIFA LADO RODA PALIO
51397,CALOTA PLASTICA PRATA ARO 14 ONIX
M4674,BUCHA BAND DIANT FOX
42912,PALHETA SILICONE UNIVERSAL
33233,TAMPA RESERV AGUA RAD NEW FIESTA
33104,BUCHA BARRA ESTAB DIANT ONIX
15111,VALVULA ESCAPE CELTA CORSA
54715,VALVULA ESCAPE GOL
24919,BUCHA BAND DIANT PALIO ADV
34746,KIT AMORT TRAS FIESTA
15424,OLEO MOTOR CASTROL GTX DIESEL 15W40
42906,KIT AMORT TRAS GOL PARCIAL
48453,TUCHO MOTOR GOL POWER
39990,TRAVA PARAFUSO ROSCA TORQUE ALTO
M3199,VELA IGNIÇAO FIESTA
39368,KIT AMORT TRAS POLO FOX
995,VELA IGNICAO GOL MI
37315,TUCHO HID MOTOR S10 CORSA
47071,BUCHA BARRA ESTAB DIANT CITY
25586,LIMPA AR COND CLASSIC ORBI 200ML
22108,DESCARBONIZANTE POWER CLEAN LOCTITE
10042,KIT AMORT TRAS PALIO
21521,VELA IGNIÇAO CLIO SANDERO
44567,TUCHO VALVULA VW UP GOL
21161,BUCHA EIXO TRAS CELTA
M5869,GUIA VALVULA GOLF
2704,FILTRO OLEO HONDA CIVIC
43456,FILTRO OLEO PEUGEOT
44234,VALVULA ADM GOL
46575,GUIA VALVULA CITROEN C3
1008,VELA IGNIÇAO ASTRA CORSA
30948,BUCHA BARRA ESTAB DIANT HB20
21521,VELA IGNICAO CLIO SANDERO
M0827,VELA IGNIÇAO PALIO FIRE
20014,VELA IGNICAO NOVO UNO EVO
M2567,KIT AMORT TRAS GOL GIII/GV PARCIAL
39105,FILTRO CABINE TUCSON
1659,JG ESCORA BALANCIM PALIO CORSA
28795,GUARNIÇAO FLANGE COMB PALIO
M5783,VELA IGNICAO PALIO CORSA
M5783,VELA IGNIÇAO PALIO CORSA
21169,BUCHA BAND DIANT FOX
51754,KIT CENTRAL BARRA ESTAB DIANT UNO
44644,GUIA VALVULA FIESTA STD
8762,GUIA VARETA GOLF FOX GOL
53687,FILTRO AR CORSA AGILE
44575,GUIA VALVULA PALIO 16V
44574,GUIA VALVULA PALIO FIRE STD
26483,BUCHA BARRA ESTAB DIANT AGILE
49665,BUCHA BARRA ESTAB DIANT AGILE
21170,BUCHA SUP AMORT TRAS GOL
25003,PARAFUSO RODA CROMADO GOL VOY
27908,ADITIVO RAD ROSA ORBI QUIMICA
12818,BUCHA BAND TRAS UNO MILLE
26218,BUCHA INF AMORT TRAS GOL
M5576,GUIA VALVULA GOL
12642,KIT BARRA ESTAB UNO
M1230,COXIM ESCAPAMENTO GOL
31289,FUSIVEL MINI PERFIL BAIXO 15 AMP
31918,ELETROVENTILADOR RR CITY NEW FIT
30507,ELETROVENTILADOR CN FIT CITY
54268,CAIXA DIREÇAO ELETRICA ARGO
26815,KIT ANEL SINCRONIZADOR PALIO 1º 2º VEL
38840,ELETROVENTILADOR GOL GV COM AR
40453,AMORT DIANT PALIO NOVO LD
22729,PNEU 185/60 R15 H/T 88H TE307 TRIANGLE
54891,PNEU 185/65 R14 H/T 86H MH01 SPEEDMAX
M0970,PNEU 175/70 R13 82T SH406 SAILLUN
M0374,RADIADOR AGUA PALIO FIRE
51673,COXIM CAMBIO COBALT LE
27991,COXIM MOTOR ONIX MANUAL LD
15637,BOBINA IGNIÇAO PALIO FIRE
7287,COXIM AMORT DIANT COROLLA
40999,SENSOR ABS DIANT UNO PALIO LE/LD
52126,BOBINA IGNIÇAO KWID
47338,BICO INJETOR LOGAN
M3991,TENSIONADOR CORREIA ALTERN PALIO
2728,CILINDRO MESTRE PALIO
53791,JUNTA CABEÇOTE LOGAN
7601,JG BRONZE MANCAL PALIO FIRE 025
27195,AMORT TRAS PRISMA ONIX
7969,ATUADOR EMBREAGEM FIESTA
11245,JUNTA FIXA PALIO MPI UNO FIRE
22411,BATERIA MOTO 5AMP
32506,SENSOR ABS TRAS GOL LD
29364,CILINDRO MESTRE EMBREAGEM PEDAL PALIO
11982,JG BRONZE BIELA STRADA FIRE STD
31052,JUNTA TAMPA VALVULA FIT
23443,KIT AMORT DIANT LOGAN SANDERO
29365,CILINDRO AUX EMBREAGEM PALIO
31985,JG PASTILHA FREIO DIANT ONIX NOVO
41208,COXIM CAMBIO INF PALIO
45245,TAMPA RESERV AGUA TORO
36375,KIT COBERTURA CORREIA GOL
45485,CORREIA DENTADA BOMBA OLEO FIESTA
M0502,SENSOR TEMP GOL KOMBI VERDE
37448,KIT LAMPADA SUPER LED H4 8000K CODE
45559,KIT AMORT DIANT ETIOS
50746,PIVO SUSP RENEGADE
21026,BOMBA AGUA FIESTA ZETEC
46735,ROLAMENTO RODA DIANT CORSA
25785,PIVO SUSP GOL GV LE
20670,CORREIA ALTERNADOR FIESTA
51536,TERMINAL DIREÇAO COBALT/PRISMA LE
34342,ROLAMENTO RODA TRAS PEUGEOT 206
27994,BRAÇO DIREÇAO PALIO NOVO
50307,PIVO SUSP INF ARGO LE
M1247,SAPATA FREIO CORSA
5371,RESERV AGUA RAD FIESTA
25845,JG CABO VELA ONIX
7641,PIVO SUSP DIANT ECOSPORT FIESTA
32666,TERMINAL DIREÇAO PALIO SIENA LE
38522,CABO FREIO TRAS PALIO ATTRACTIVE LE
54141,CORREIA DENTADA FOX GOL 135D
32200,PIVO SUSP DIANT NOVO KA ECOSPORT
30093,SUPORTE BARRA TENSOR CORSA LE
8099,VALVULA TERMOST CORSA
50174,PIVO INF MARCH LD/LE
51535,TERMINAL DIREÇAO COBALT/PRISMA LD
42388,BRAÇO DIREÇAO COBALT
25941,BUCHA BAND TRAS COBALT
40245,PIVO INFERIOR HB20
27144,PIVO SUSP DIANT ONIX
37324,CABO EMBREAGEM PALIO FIRE
50861,CORREIA ALTERN VW UP
26869,KIT ROLAMENTO TRAS CORSA
52420,KIT AMORT TRAS ONIX
21712,SENSOR TEMP CORSA
21059,OLEO MOTOR CASTROL MAGNATEC 5W30
49939,CORREIA ALTERN GOL
52850,COXIM AMORT TRAS ETIOS
34283,BUCHA DIANT BAND SUSP DIANT HRV
45729,FILTRO OLEO TORO RENAGADE
48858,PALHETA LIMPADOR HB20 PB26
17731,BRAÇO DIREÇAO PALIO NOVO
48227,JUNTA SAIDA ESCAP UNO
46433,RETENTOR POLIA FORD KA
51878,BRAÇO DIREÇAO ONIX COBALT
42940,PALHETA LIMPADOR GOL GVI PG22
55137,BUCHA BAND TRAS GOL GV
44239,FILTRO AR ONIX
M0247,RETENTOR COMANDO PALIO FIRE
11183,BUCHA BAND CORSA MONTANA
13655,TAMPA RESERV AGUA FOX
55121,FILTRO AR HB20
36673,TENSOR CORREIA ALTERN PALIO FIRE
11870,MANGUEIRA SUP RAD CELTA
34794,TAMPA RESERV AGUA NEW FIESTA
12401,MANGUEIRA COLETOR ADM CORSA
30396,FILTRO AR UNO EVO
38950,KIT COIFA L CAMBIO CLIO LE
47513,KIT COIFA L RODA PALIO
41543,JUNTA DIFERENCIAL CORSA
34004,FILTRO OLEO TUCSON HB20
12283,FILTRO AR FOX GOL GV
46116,FILTRO CABINE ONIX
42913,PALHETA SILICONE GM
42958,CONDICIONADOR METAIS MILITEC 40ML
46996,FILTRO AR ETIOS
19054,FILTRO CABINE FIESTA FUSION
40535,BUCHA BARRA ESTAB DIANT DUSTER
39761,KIT COIFA L RODA CORSA
1653,RELE PISCA VW/GM/FORD S/SUPORTE
26129,LIMPA AR COND LAVANDA ORBI
M4040,FILTRO OLEO CLIO SANDERO
45126,FILTRO COMBUSTIVEL GOL
37506,FILTRO OLEO RENAULT KWID
2662,RELE MINI AUX TOYOTA FIAT GM VW
55059,KIT LAMPADA LED PINGO T10 12 LEDS
M0733,FILTRO OLEO CORSA
652,FILTRO OLEO CORSA
13570,PORCA RODA FIESTA KA 3620012154
45902,"SELO BLOCO CORSA 34,40MM"
637,LIXA D AGUA 3M GR80
14039,COXIM ESCAPAMENTO PALIO
285,FUSIVEL MINI LAMINA 05 AMP
13337,LAMPADA PINGUINHO DAGUA T2721
44910,ELETROVENTILADOR COROLLA ETIOS 17
35421,KIT EMBREAGEM GRAND SIENA NOVO
54878,ELETROVENTILADOR RR CITY NEW FIT
44646,COMANDO VALVULA GOL KOMBI
49214,AMORT DIANT PALIO ECONOMY
54890,PNEU 205/55 R16 H/T 91H/V DURABLE
33303,CILINDRO MESTRE FREIO UNO PALIO ABS
54983,RADIADOR AGUA GOL GV AR
M0374,RADIADOR AGUA PALIO FIRE
M1604,PNEU 175/70 R14 DUNLOP
46149,AMORT DIANT PALIO NOVO LE
37258,AMORT DIANT VW UP
55320,PNEU 175/70 R14 84T HIFLY
25862,PNEU 195/60 R15 88V TE307 TRIANGLE
54159,GARFO EMBREAGEM HB20
41746,AMORT DIANT HB20 LE
47668,AMORT DIANT KWID LE/LD
M2875,SILENCIOSO TRAS PALIO TODOS
38840,ELETROVENTILADOR GOL GV COM AR
50731,SENSOR ABS TRAS HB20
17142,JG ANEL SEGMENTO GOL GV
47971,CORREIA DENTADA FIESTA
46943,BOMBA AGUA MOBI UNO 3CC
32317,VALVULA TERMOSTATICA PALIO ETORQ
37565,SENSOR ABS DIANT PALIO LD/LE
30375,CUBO RODA TRAS NEW FIT COM ABS
44333,COXIM DIANT MOTOR KWID LD
11633,COXIM DIANT MOTOR UNO LD
10589,SAPATA FREIO GRAND SIENA
54329,TENSOR CORREIA DENTADA GOL VW UP
M1460,AMORT DIANT FIESTA
7850,KIT AMORT DIANT FOX POLO COMPLETO
41393,JUNTA FIXA LD RODA NOVO PALIO
27425,AMORT TRAS GRAND SIENA
42354,BOBINA IGNIÇAO NOVO KA
54508,JG PASTILHA FREIO DIANT NOVO POLO
44208,CILINDRO AUX EMB HB20
26021,HASTE ALAVANCA SELETORA CORSA
44542,JUNTA FIXA PRISMA ONIX
45061,VELA IGNICAO HB20
7018,CILINDRO MESTRE FREIO PALIO STRADA
49003,JG PISTAO C/ ANEL KWID 050
5013,AMORT TRAS FIESTA
32899,CORREIA DENTADA FOX VW UP
51297,KIT AMORT DIANT HB20
54170,POLIA ALTERNADOR GOL GVIII
25462,DISCO FREIO DIANT DOBLO
44523,KIT AMORT DIANT KWID
45769,KIT REPARO TRAMBULADOR LOGAN
7598,JG BRONZE BIELA PALIO FIRE STD
M3448,TAMBOR FREIO CELTA
53136,AMORT TRAS GOL GII GIII
54951,TENSOR CORREIA DENTADA CLIO
36806,BORRACHA PORTA LATERAL LOGAN
49119,JUNTA CABEÇOTE LOGAN
51284,JG PASTILHA FREIO DIANT COROLLA
29616,TAMPA COMANDO VALV CELTA
35540,KIT AMORT DIANT CORSA HATCH
M3982,SENSOR NIVEL COMB GOL
53181,CONEXAO BOMBA AGUA FORD KA
7565,SAPATA FREIO PALIO
M0489,JUNTA CABEÇOTE COBALT FLEX
5882,JUNTA CABEÇOTE FIESTA
14816,COXIM AMORT DIANT PALIO LE
25424,JG PASTILHA FREIO DIANT PALIO
31165,CORREIA ELASTICA DH PUNTO UNO
41700,JUNTA CABEÇOTE HB20
17574,CORREIA DENTADA PEUGEOT 206 95D
38569,TERMINAL DIREÇAO NEW FIT LD
M1252,KIT AMORT DIANT GOL GIII GIV
26842,PIVO INF HONDA NEW FIT
51311,RESERV AGUA RAD UNO
38570,TERMINAL DIREÇAO NEW FIT LE
28347,PALHETA LIMPADOR DIANT UNO NOVO
4367,SUPORTE BARRA TENSOR CORSA LD
53680,BOMBA AGUA GOL
39070,KIT COBERTURA CORREIA NOVO PALIO
13692,SENSOR ROTAÇAO PALIO FIRE
52505,AMORT MALA GRAND SIENA
29476,JUNTA COLETOR ADM UNO EVO
33102,COXIM AMORT TRAS NEW FIESTA
45592,COXIM AMORT DIANT HB20
38523,CABO FREIO TRAS PALIO ATTRACTIVE LD
37348,CORREIA ALTER COBALT
35804,TERMINAL DIREÇAO COBALT/PRISMA LE
25629,ARTICULADOR CABO ENGATE CORSA
40222,TERMINAL DIREÇAO ETIOS LE
52623,TERMINAL DIRECAO ARGO LE
49968,VALVULA TERMOST GOL FOX
45301,TRIZETA ONIX C3 CIVIC
32667,TERMINAL DIREÇAO PALIO SIENA LD
53884,TERMINAL DIREÇAO COROLLA LE/LD
4621,JUNTA CARTER FIESTA ECOSPORT
7044,SAPATA FREIO CORSA
39636,KIT AMORT TRAS COBALT
47995,VELA IGNICAO ONIX 3CC
6675,JUNTA CABEÇOTE PALIO FIRE 16V
26340,MANGUEIRA AR QUENTE PALIO
29895,JG PASTILHA FREIO DIANT ONIX
238,COXIM AMORT TRAS HB20
30941,KIT AMORT DIANT ONIX PARCIAL
51529,PIVO INF ETIOS
M5543,AMORT MALA ONIX
45830,BRAÇO DIREÇAO KWID
45197,PORTA ESCOVA DUSTER
31065,BRAÇO DIREÇAO HB20
18968,PESCADOR BOMBA OLEO NOVO GOL
7800,BUCHA BAND DIANT FIESTA
29357,BRAÇO DIREÇAO PUNTO
48637,PIVO SUSP DIANT GOL GV LD
M0442,TERMINAL DIREÇAO TENSOR UNO
36989,BIELETA BARRA ESTAB DIANT HRV LD
36990,BIELETA BARRA ESTAB DIANT HRV LE
8891,CORREIA ACD GOL GV
325,CILINDRO RODA CORSA
17481,CORREIA ALTERN PALIO
52524,VALVULA ADM KWID
26378,TENSOR CORREIA ALTERN PEUGEOT 206
38113,JG PASTILHA FREIO DIANT CORSA
18160,CORREIA ALTERN PALIO
42931,PALHETA LIMPADOR ONIX JOY LD PF14
15157,CILINDRO RODA PALIO PUNTO
41867,PIVO SUSP INF DIANT PALIO
48854,PALHETA LIMPADOR HB20 PB14
24758,CORREIA ALTERNADOR FIT
47590,VALVULA ESCAPE ONIX
37237,FILTRO AR RENAULT DUSTER
20620,CILINDRO RODA CELTA PRISMA
43087,BIELETA BARRA ESTAB ECOSPORT
M0244,RETENTOR DIANT POLIA CORSA
49547,INTERRUPTOR OLEO CORSA
55253,KIT AMORT DIANT PALIO
35703,KIT AMORT TRAS SAVEIRO
M5670,TERMINAL DIREÇAO MONTANA CORSA
48861,PALHETA LIMPADOR TRAS CELTA
35514,BUCHA BARRA ESTAB DIANT TORO
42939,PALHETA LIMPADOR GOL PG16
54673,RETENTOR COMANDO CORSA
39844,MANGUEIRA SUP RAD PRISMA
47591,VALVULA ADMISSAO ONIX
45829,BUCHA BAND DIANT COROLLA
40839,BUCHA BARRA ESTAB DIANT FIT
48025,BUCHA BAND DIANT VERSA
53069,KIT AMORT TRAS IDEA PUNTO
36939,BRAÇO DIREÇAO PALIO NOVO
52518,PALHETA LIMPADOR FIESTA
14030,KIT LAMPADA PINGO DAGUA T10 9 LEDS
54459,OLEO MOTOR LUBRAX ESSENCIAL SL 20W50
44354,REPARO ALAVANCA CAMBIO GOL GV
53336,VALVULA ADM ARGO
33029,FILTRO AR COROLLA
45388,BUCHA BAND DIANT ONIX
53311,GUIA VALVULA ADM/ESC ARGO STD
20741,BUCHA DIANT BAND COROLLA
21114,LAMPADA HALOGENA HB4
49244,VALVULA ESCAPE FORD KA
49262,PALHETA DIANT SILICONE UNIVERSAL
26331,MANGUEIRA SUP RAD CORSA
2230,PORTA ESCOVA MT PARTIDA GM/FIAT
4132,BUCHA BAND DIANT POLO FOX
45984,BUCHA BARRA ESTAB DIANT ARGO
40706,KIT AMORT DIANT FIESTA
29308,VELA IGNIÇAO PICANTO HB20
51125,BUCHA BARRA ESTAB SANDERO
42914,PALHETA SILICONE UNIVERSAL DIANT
39991,TRAVA PARAFUSO ROSCA TORQUE MEDIO
53623,ADITIVO RAD CONC VERDE MAHLE
40024,BUCHA BAND DIANT KWID
55037,CAIXA DIREÇAO HIDR ONIX
28230,FILTRO AR ETIOS
M1399,FILTRO AR FIESTA
50461,ROLAMENTO ALTERN
55080,BUCHA BARRA ESTAB DIANT POLO
54407,KIT COIFA L RODA PALIO
45915,ADITIVO RAD AMARELO PARAFLU PRONTO P/ USO
M4689,BUCHA COXIM AMORT TRAS CORSA
44837,PALHETA DIANT UNIVERSAL
11714,FILTRO CABINE GOL FOX
50344,FILTRO CABINE POLO
30098,FILTRO CABINE VW UP
6838,CONECTOR 2 VIAS LAMPADA H11
M2357,BUCHA BAND DIANT NEW FIESTA NOVO KA
M1229,PRATO SUP AMORT DIANT GOL
46579,GUIA VALVULA ESC GOL STD
29596,FILTRO OLEO COROLLA
6615,KIT AMORT DIANT GOL VOYAGE
647,FILTRO OLEO PALIO
30587,DIFUSOR AR CENTRAL/LATERAL CELTA
9731,TAMPA RESERV AGUA FIESTA
3747,BUCHA BRAÇO OSCILANTE UNO
31766,MANGUEIRA SANFONADA 330MM 1509
16625,FILTRO OLEO GOL SANTANA
6360,ROLDANA MAQUINA VIDRO GOL GIII
51755,KIT LATERAL BARRA ESTAB DIANT UNO
53068,FILTRO AR CELTA
1201,BUJAO CARTER MILLE
47015,BUCHA SUP AMORT TRAS GOL
12345,JUNTA TAMPA SELETORA CAMBIO CORSA
M1365,COIFA CX DIREÇAO UNO LE
29016,ANEL BOBINA DISTRIB CORSA
53732,RETENTOR HAST VALV ADM ONIX
53733,RETENTOR HAST VALV ESCAPE ONIX
M3647,CONECTOR 2 VIAS SENSOR TEMP PALIO
15656,BUCHA BRAÇO TENSOR DIANT UNO
25684,LAMPADA PAINEL BASE AZUL
292,FUSIVEL MAXI LAMINA 40 AMP
M5104,ARRUELA BUJAO CARTER COBRE UNIVERSAL
18067,FITA ISOLANTE IMPERIAL 19MMX10M
39757,CABEÇOTE MOTOR GOL FOX
40630,CAIXA DIREÇAO ELETRICA FOX
M0446,ARVORE MANIVELA PALIO FIRE
48648,RADIADOR AGUA COBALT
51555,ELETROVENTILADOR LOGAN 15>> OROCH
47164,ELETROVENTILADOR RENAULT KWID 1.0
53806,ELETROVENTILADOR RENAULT KWID 1.0
32761,KIT AMORT DIANT TORO RENEGADE
50549,AMORT DIANT DUSTER
27576,AMORT DIANT NEW FIT LE
37437,RADIADOR AGUA GOL GV AR
19632,TENSIONADOR CORREIA ALTERN NEW FIT
45355,COMANDO VALV CORSA CELTA
34418,AMORT DIANT NEW FIT LD
37347,RADIADOR AGUA PRISMA CELTA 06....
51817,AMORT DIANT DUSTER
19312,PNEU 205/55 R16 91V ULTIMA PLUS DELMAX
38926,COXIM MOTOR LD NEW FIT
45071,JG ANEL SEGMENTO KWID STD
13397,AMORT DIANT FOX/POLO
37455,RADIADOR AGUA PALIO FIRE STRADA
13613,SONDA LAMBDA PRE CAT FIESTA
39684,AMORT DIANT KWID
14815,COXIM AMORT DIANT PALIO LD
32664,JG ANEL SEGMENTO UNO PALIO STD
31901,AMORT DIANT GOL GV
36380,JUNTA FIXA COBALT SPIN
44207,CILINDRO AUXILIAR EMBREAGEM HB20
36105,TENSIONADOR CORREIA ALTERN FORD KA
21053,JG JUNTA MOTOR PALIO FIRE
44328,CILINDRO AUX EMBREAGEM GOL
23171,BICO INJETOR FOX GOL GV
40767,KIT AMORT TRAS RENEGADE
55023,REPARO ALAVANCA CAMBIO GOL GV
25837,BOBINA IGNIÇAO CERATO
M0926,BOBINA IGNIÇAO CORSA CELTA
13757,MANGUEIRA INF RAD PALIO
15385,JG BRONZE BIELA POLO/FOX
32066,BOBINA IGNIÇAO HB20
44523,KIT AMORT DIANT KWID COMPLETO
21451,BOBINA IGNIÇAO NEW CIVIC
46185,KIT JUNTA TAMPA VALV ARGO
32280,COXIM MOTOR NOVO UNO LD
4441,CUBO RODA TRAS SIENA PALIO
50829,KIT AMORT DIANT ETIOS
39249,JG BRONZE BIELA HB20
44878,COXIM CAMBIO TRAS LOGAN SANDERO
39003,MACACO MAXI LIGHT UNIVERS 600 KG
54696,TENSOR CORREIA DENTADA GOL AT
52286,ROLAMENTO RODA DIANT KWID
6377,RETENTOR VOLANTE PALIO FIRE
37490,JG PASTILHA FREIO DIANT CITY
46396,CORREIA ALTERN DH ELASTICA PUNTO
10738,SENSOR TEMP CLIO SANDERO
7048,SAPATA FREIO GRAN SIENA CLIO ARGO
53946,ROLAMENTO RODA TRAS FIESTA
36460,SENSOR TEMP PRISMA ONIX
27775,ROLAMENTO RODA DIANT PALIO COM ABS